{
  "$comment": "INVALID — pivot-ordering. pivotIndex 5 points past the end of a 2-step plan. The pivot must point at a real step: it is the line in the plan past which there is no rollback, and that line has to exist.",
  "sagaId": "sg_01J8Z9",
  "planVersion": 1,
  "authoredBy": { "agent": "planner@acme", "model": "claude-opus-5" },
  "signature": "ed25519:3q2mZk9vXw0pRt5uYh8jLn4bVc6xSd7f",
  "pivotIndex": 5,
  "mandate": {
    "maxSpendEur": 250,
    "expiresAt": "2027-08-07T18:00:00Z"
  },
  "steps": [
    {
      "id": "s0",
      "tool": "vendor.create",
      "class": "compensable",
      "compensation": { "tool": "vendor.archive", "args": { "ref": "$s0.id" } },
      "idempotencyKey": "sg_01J8Z9:s0"
    },
    {
      "id": "s1",
      "tool": "payments.capture",
      "class": "irreversible",
      "idempotencyKey": "sg_01J8Z9:s1"
    }
  ]
}
