{
  "$comment": "INVALID — undo-ttl. The human review (s2) declares no maxDurationSeconds: a person might approve in a minute or go on holiday for two weeks. The budget hold (s1) auto-releases after 86400s. An unbounded wait cannot sit inside a bounded undo window — the worst-case time to reach the pivot cannot even be computed, so it cannot be proven to fit. Give the human a deadline.",
  "sagaId": "sg_01J8Z9",
  "planVersion": 1,
  "authoredBy": { "agent": "planner@acme", "model": "claude-opus-5" },
  "signature": "ed25519:3q2mZk9vXw0pRt5uYh8jLn4bVc6xSd7f",
  "pivotIndex": 3,
  "mandate": {
    "maxSpendEur": 250,
    "expiresAt": "2027-08-07T18:00:00Z"
  },
  "steps": [
    {
      "id": "s0",
      "tool": "vendor.create",
      "class": "compensable",
      "compensation": { "tool": "vendor.archive", "args": { "ref": "$s0.id" } },
      "maxDurationSeconds": 60,
      "idempotencyKey": "sg_01J8Z9:s0"
    },
    {
      "id": "s1",
      "tool": "budget.reserve",
      "class": "compensable",
      "compensation": { "tool": "budget.release", "args": { "ref": "$s1.hold" } },
      "undoTtlSeconds": 86400,
      "maxDurationSeconds": 60,
      "idempotencyKey": "sg_01J8Z9:s1"
    },
    {
      "id": "s2",
      "tool": "approvals.humanReview",
      "class": "compensable",
      "compensation": { "tool": "approvals.void", "args": { "ref": "$s2.ticket" } },
      "idempotencyKey": "sg_01J8Z9:s2"
    },
    {
      "id": "s3",
      "tool": "payments.capture",
      "class": "irreversible",
      "maxSpendEur": 180,
      "idempotencyKey": "sg_01J8Z9:s3"
    },
    {
      "id": "s4",
      "tool": "sandbox.provision",
      "class": "retriable",
      "idempotencyKey": "sg_01J8Z9:s4"
    },
    {
      "id": "s5",
      "tool": "email.credentials",
      "class": "retriable",
      "idempotencyKey": "sg_01J8Z9:s5"
    }
  ]
}
