{
  "$comment": "INVALID — key-integrity. The capture step (s3) carries a canonical-bytes idempotency key, but the hash suffix was computed when the step declared maxSpendEur 175; the payload now says 180. Same key, different bytes: a replay presented a different payload under the same idempotency key, and the validator refuses it before execution. The other steps carry legacy `${sagaId}:${stepId}` keys, which claim no integrity and are left alone.",
  "sagaId": "sg_01J8Z9",
  "planVersion": 1,
  "authoredBy": { "agent": "planner@acme", "model": "claude-opus-5" },
  "signature": "ed25519:3q2mZk9vXw0pRt5uYh8jLn4bVc6xSd7f",
  "pivotIndex": 3,
  "mandate": {
    "maxSpendEur": 250,
    "expiresAt": "2027-08-07T18:00:00Z"
  },
  "steps": [
    {
      "id": "s0",
      "tool": "vendor.create",
      "class": "compensable",
      "compensation": { "tool": "vendor.archive", "args": { "ref": "$s0.id" } },
      "maxDurationSeconds": 60,
      "idempotencyKey": "sg_01J8Z9:s0"
    },
    {
      "id": "s1",
      "tool": "budget.reserve",
      "class": "compensable",
      "compensation": { "tool": "budget.release", "args": { "ref": "$s1.hold" } },
      "undoTtlSeconds": 86400,
      "maxDurationSeconds": 60,
      "idempotencyKey": "sg_01J8Z9:s1"
    },
    {
      "id": "s2",
      "tool": "compliance.check",
      "class": "compensable",
      "compensation": { "tool": "compliance.discard", "args": { "ref": "$s2.report" } },
      "maxDurationSeconds": 3600,
      "idempotencyKey": "sg_01J8Z9:s2"
    },
    {
      "id": "s3",
      "tool": "payments.capture",
      "class": "irreversible",
      "maxSpendEur": 180,
      "idempotencyKey": "sg_01J8Z9:s3:7a91186e5ccea300dfb87fd11444036ee0e172419fa719b9b956b9f12eeaeb56"
    },
    {
      "id": "s4",
      "tool": "sandbox.provision",
      "class": "retriable",
      "idempotencyKey": "sg_01J8Z9:s4"
    },
    {
      "id": "s5",
      "tool": "email.credentials",
      "class": "retriable",
      "idempotencyKey": "sg_01J8Z9:s5"
    }
  ]
}
