{
  "$comment": "INVALID — undo-ttl. The budget hold (s1) auto-releases after 86400s (24h), but the compliance registry (s2) can take up to 172800s (48h) in the worst case. Worst-case time to reach the pivot is 172920s: by the time the saga reaches payments.capture — or needs to roll back just before it — the undo has already expired. The worst-case time to reach the pivot must fit inside the shortest undo TTL on the path.",
  "sagaId": "sg_01J8Z9",
  "planVersion": 1,
  "authoredBy": { "agent": "planner@acme", "model": "claude-opus-5" },
  "signature": "ed25519:3q2mZk9vXw0pRt5uYh8jLn4bVc6xSd7f",
  "pivotIndex": 3,
  "mandate": {
    "maxSpendEur": 250,
    "expiresAt": "2027-08-07T18:00:00Z"
  },
  "steps": [
    {
      "id": "s0",
      "tool": "vendor.create",
      "class": "compensable",
      "compensation": { "tool": "vendor.archive", "args": { "ref": "$s0.id" } },
      "maxDurationSeconds": 60,
      "idempotencyKey": "sg_01J8Z9:s0"
    },
    {
      "id": "s1",
      "tool": "budget.reserve",
      "class": "compensable",
      "compensation": { "tool": "budget.release", "args": { "ref": "$s1.hold" } },
      "undoTtlSeconds": 86400,
      "maxDurationSeconds": 60,
      "idempotencyKey": "sg_01J8Z9:s1"
    },
    {
      "id": "s2",
      "tool": "compliance.check",
      "class": "compensable",
      "compensation": { "tool": "compliance.discard", "args": { "ref": "$s2.report" } },
      "maxDurationSeconds": 172800,
      "idempotencyKey": "sg_01J8Z9:s2"
    },
    {
      "id": "s3",
      "tool": "payments.capture",
      "class": "irreversible",
      "maxSpendEur": 180,
      "idempotencyKey": "sg_01J8Z9:s3"
    },
    {
      "id": "s4",
      "tool": "sandbox.provision",
      "class": "retriable",
      "idempotencyKey": "sg_01J8Z9:s4"
    },
    {
      "id": "s5",
      "tool": "email.credentials",
      "class": "retriable",
      "idempotencyKey": "sg_01J8Z9:s5"
    }
  ]
}
