{
  "$comment": "INVALID — pivot-ordering. The credentials email (s5) claims class 'compensable' with an email.retract compensation, but it sits AFTER the pivot at index 3. Past the pivot there is no rollback — only apology. Everything at or after the pivot is one-way (retriable or irreversible); a compensation back there would never run.",
  "sagaId": "sg_01J8Z9",
  "planVersion": 1,
  "authoredBy": { "agent": "planner@acme", "model": "claude-opus-5" },
  "signature": "ed25519:3q2mZk9vXw0pRt5uYh8jLn4bVc6xSd7f",
  "pivotIndex": 3,
  "mandate": {
    "maxSpendEur": 250,
    "expiresAt": "2027-08-07T18:00:00Z"
  },
  "steps": [
    {
      "id": "s0",
      "tool": "vendor.create",
      "class": "compensable",
      "compensation": { "tool": "vendor.archive", "args": { "ref": "$s0.id" } },
      "maxDurationSeconds": 60,
      "idempotencyKey": "sg_01J8Z9:s0"
    },
    {
      "id": "s1",
      "tool": "budget.reserve",
      "class": "compensable",
      "compensation": { "tool": "budget.release", "args": { "ref": "$s1.hold" } },
      "undoTtlSeconds": 86400,
      "maxDurationSeconds": 60,
      "idempotencyKey": "sg_01J8Z9:s1"
    },
    {
      "id": "s2",
      "tool": "compliance.check",
      "class": "compensable",
      "compensation": { "tool": "compliance.discard", "args": { "ref": "$s2.report" } },
      "maxDurationSeconds": 3600,
      "idempotencyKey": "sg_01J8Z9:s2"
    },
    {
      "id": "s3",
      "tool": "payments.capture",
      "class": "irreversible",
      "idempotencyKey": "sg_01J8Z9:s3"
    },
    {
      "id": "s4",
      "tool": "sandbox.provision",
      "class": "retriable",
      "idempotencyKey": "sg_01J8Z9:s4"
    },
    {
      "id": "s5",
      "tool": "email.credentials",
      "class": "compensable",
      "compensation": { "tool": "email.retract", "args": { "ref": "$s5.messageId" } },
      "idempotencyKey": "sg_01J8Z9:s5"
    }
  ]
}
